{
  "event_id": "evt_01J8Z3Q7K2M4N6P8R0S2T4V022",
  "event_type": "channel.billing_suspended",
  "occurred_at": "2026-09-28T14:30:00Z",
  "business_id": "biz_01J8Z2A4B6C8D0E2F4G6H8J0K2",
  "channel_id": "chn_01J8Z2M4N6P8Q0R2S4T6V8W0X2",
  "data": {
    "channel_id": "chn_01J8Z2M4N6P8Q0R2S4T6V8W0X2",
    "business_id": "biz_01J8Z2A4B6C8D0E2F4G6H8J0K2",
    "mode": "coexistence",
    "display_phone_number": "+55 11 3000-0000",
    "billing_state": "suspended",
    "current_period_end": "2026-10-25T14:20:00Z",
    "grace_until": "2026-09-28T14:20:00Z",
    "suspended_at": "2026-09-28T14:30:00Z",
    "amount_due_micros": "29900000",
    "available_micros": "120000",
    "monthly_fee_micros": "29900000"
  }
}
