{
  "event_id": "evt_01J8Z3Q7K2M4N6P8R0S2T4V041",
  "event_type": "contact.opted_out",
  "occurred_at": "2026-09-27T14:05:00Z",
  "business_id": "biz_01J8Z2A4B6C8D0E2F4G6H8J0K2",
  "channel_id": "chn_01J8Z2M4N6P8Q0R2S4T6V8W0X2",
  "data": {
    "business_id": "biz_01J8Z2A4B6C8D0E2F4G6H8J0K2",
    "channel_id": "chn_01J8Z2M4N6P8Q0R2S4T6V8W0X2",
    "phone": "+5511988887777",
    "source": "keyword",
    "keyword": "SAIR",
    "opt_out_id": "opt_01J8Z3Q7K2M4N6P8R0S2T4V042",
    "opted_out_at": "2026-09-27T14:05:00+00:00"
  }
}
