{
  "event_id": "evt_01J8Z3Q7K2M4N6P8R0S2T4V020",
  "occurred_at": "2026-10-11T14:05:00Z",
  "business_id": null,
  "channel_id": null,
  "event_type": "billing.balance_low",
  "data": {
    "balance_micros": "4800000",
    "reserved_micros": "20000",
    "available_micros": "4780000",
    "low_balance_threshold_micros": "5000000",
    "balance": "4.8"
  }
}
