{
  "event_id": "evt_01J8Z3Q7K2M4N6P8R0S2T4V040",
  "event_type": "business.compliance_hold",
  "occurred_at": "2026-09-27T14:05:00Z",
  "business_id": "biz_01J8Z2A4B6C8D0E2F4G6H8J0K2",
  "channel_id": null,
  "data": {
    "hold_id": "chd_01J8Z3Q7K2M4N6P8R0S2T4V041",
    "state": "active",
    "scope": "business",
    "business_id": "biz_01J8Z2A4B6C8D0E2F4G6H8J0K2",
    "reason": "meta_account_violation",
    "source": "meta_signal",
    "message": "A Meta registrou violação de política na conta do WhatsApp",
    "created_at": "2026-09-27T14:05:00Z",
    "lifted_at": null
  }
}
