{
  "event_id": "evt_01J8Z3Q7K2M4N6P8R0S2T4V008",
  "event_type": "message.received",
  "occurred_at": "2026-09-24T14:05:00Z",
  "business_id": "biz_01J8Z2A4B6C8D0E2F4G6H8J0K2",
  "channel_id": "chn_01J8Z2M4N6P8Q0R2S4T6V8W0X2",
  "data": {
    "message_id": "msg_01J8Z3T2V4W6X8Y0Z2A4B6C8D0",
    "direction": "outbound",
    "origin": "business_app",
    "type": "text",
    "from": "+551130000000",
    "to": "+5511988887777",
    "text": {
      "body": "Saiu sim, chega em 20 minutos!"
    },
    "contact_name": null,
    "meta_message_id": "wamid.HBgNNTUxMTk4ODg4Nzc3NxUCABIYFkVDSE8",
    "meta_timestamp": "2026-09-24T14:04:59Z",
    "imported": false
  }
}
