{
  "event_id": "evt_01J8Z3Q7K2M4N6P8R0S2T4VB05",
  "occurred_at": "2026-10-20T15:30:00Z",
  "business_id": null,
  "channel_id": null,
  "event_type": "billing.invoice_paid",
  "data": {
    "invoice_id": "inv_01J8Z3Q7K2M4N6P8R0S2T4VI01",
    "subscription_id": "sub_01J8Z3Q7K2M4N6P8R0S2T4VS01",
    "kind": "subscription",
    "total_micros": "149700000",
    "paid_at": "2026-11-03T10:12:00Z",
    "paid_via": "pix"
  }
}
