{
  "event_id": "evt_01J8Z3Q7K2M4N6P8R0S2T4VB07",
  "occurred_at": "2026-10-20T15:30:00Z",
  "business_id": null,
  "channel_id": null,
  "event_type": "billing.subscription_updated",
  "data": {
    "subscription_id": "sub_01J8Z3Q7K2M4N6P8R0S2T4VS01",
    "status": "active",
    "seats": 3,
    "scheduled_seats": null,
    "current_period_end": "2026-11-05T14:00:00Z",
    "cancel_at_period_end": false,
    "action": "seats_added"
  }
}
