{
  "event_id": "evt_01J8Z3Q7K2M4N6P8R0S2T4V004",
  "event_type": "message.received",
  "occurred_at": "2026-09-24T14:00:00Z",
  "business_id": "biz_01J8Z2A4B6C8D0E2F4G6H8J0K2",
  "channel_id": "chn_01J8Z2M4N6P8Q0R2S4T6V8W0X2",
  "data": {
    "message_id": "msg_01J8Z3R2S4T6V8W0X2Y4Z6A8B0",
    "direction": "inbound",
    "origin": "customer",
    "type": "text",
    "from": "+5511988887777",
    "to": "+551130000000",
    "text": {
      "body": "Olá, meu pedido já saiu?"
    },
    "contact_name": "Maria",
    "meta_message_id": "wamid.HBgNNTUxMTk4ODg4Nzc3NxUCABIYFjNFQjBDRjQ1",
    "meta_timestamp": "2026-09-24T13:59:58Z",
    "imported": false
  }
}
