{
  "event_id": "evt_01J8Z3Q7K2M4N6P8R0S2T4V021",
  "occurred_at": "2026-10-11T14:05:00Z",
  "business_id": null,
  "channel_id": null,
  "event_type": "billing.balance_added",
  "data": {
    "entry_id": "wle_01J8Z3Q7K2M4N6P8R0S2T4V011",
    "kind": "topup",
    "amount_micros": "100000000",
    "balance_micros": "104800000",
    "available_micros": "104780000",
    "topup_id": "top_01J8Z3Q7K2M4N6P8R0S2T4V012"
  }
}
