{
  "event_id": "evt_01J8Z3Q7K2M4N6P8R0S2T4VB01",
  "occurred_at": "2026-10-20T15:30:00Z",
  "business_id": null,
  "channel_id": null,
  "event_type": "billing.allowance_warning",
  "data": {
    "cycle_id": "cyc_01J8Z3Q7K2M4N6P8R0S2T4VC01",
    "cycle_kind": "paid",
    "included_messages": 30000,
    "used_messages": 24000,
    "percent": 80,
    "cycle_ends_at": "2026-11-05T14:00:00Z"
  }
}
