{
  "event_id": "evt_01J8Z3Q7K2M4N6P8R0S2T4VB03",
  "occurred_at": "2026-10-20T15:30:00Z",
  "business_id": null,
  "channel_id": null,
  "event_type": "billing.overage_limit_reached",
  "data": {
    "cycle_id": "cyc_01J8Z3Q7K2M4N6P8R0S2T4VC01",
    "overage_limit_micros": "50000000",
    "overage_used_micros": "50000000"
  }
}
